{
  "description": "billable binding with a decimal budget that falls back when exceeded",
  "requirements": [
    "SR-SPEC-02"
  ],
  "level": "schema",
  "expect": {
    "valid": true
  },
  "document": {
    "apiVersion": "sirb/v1alpha1",
    "kind": "ModelBinding",
    "metadata": {
      "name": "claude-billable"
    },
    "spec": {
      "provider": "anthropic",
      "model": "claude-opus-5-5",
      "mode": "billable",
      "budget": {
        "currency": "EGP",
        "limit": "1000.50",
        "period": "month",
        "onExceeded": "fallback",
        "alertThresholds": [
          0.5,
          0.9
        ]
      },
      "fallbacks": [
        {
          "ref": "claude-haiku-billable",
          "triggers": [
            "budget-exceeded",
            "rate-limit"
          ]
        },
        {
          "ref": "local-ollama",
          "triggers": [
            "error"
          ]
        }
      ]
    }
  }
}
