{
  "description": "keys that only contain a secret word are not secret fields",
  "requirements": [
    "SR-SPEC-04"
  ],
  "level": "schema",
  "expect": {
    "valid": true
  },
  "document": {
    "apiVersion": "sirb/v1alpha1",
    "kind": "Workflow",
    "metadata": {
      "name": "sync"
    },
    "spec": {
      "steps": [
        {
          "id": "run",
          "tool": "ticket-lookup",
          "input": {
            "tokenCount": 3,
            "maxTokens": 512,
            "authorName": "Ada",
            "partitionKey": "eu",
            "idempotencyKey": "run-42",
            "secretName": "partner-api"
          }
        }
      ]
    }
  }
}
