{
  "description": "names that merely contain a secret word are allowed",
  "requirements": [
    "SR-SPEC-04"
  ],
  "level": "schema",
  "expect": {
    "valid": true
  },
  "document": {
    "apiVersion": "sirb/v1alpha1",
    "kind": "Tool",
    "metadata": {
      "name": "search-mcp"
    },
    "spec": {
      "type": "mcp",
      "description": "Search MCP server",
      "mcp": {
        "transport": "stdio",
        "command": "search-mcp",
        "env": {
          "KEYBOARD_LAYOUT": "us",
          "AUTHOR_NAME": "Ada",
          "TOKENIZERS_PARALLELISM": "false",
          "GITHUB_TOKEN_FILE": "/run/secrets/gh",
          "REPO_URL": "ssh://git@github.com/acme/handbook"
        }
      }
    }
  }
}
