{
  "description": "x-idempotency-key, CACHE_KEY and PWD are not secrets",
  "requirements": [
    "SR-SPEC-04"
  ],
  "level": "schema",
  "expect": {
    "valid": true
  },
  "document": {
    "apiVersion": "sirb/v1alpha1",
    "kind": "Tool",
    "metadata": {
      "name": "orders-mcp"
    },
    "spec": {
      "type": "mcp",
      "description": "Orders",
      "mcp": {
        "transport": "streamable-http",
        "url": "https://mcp.example.com/orders",
        "headers": {
          "x-idempotency-key": "run-42",
          "x-cache-key": "orders"
        }
      }
    }
  }
}
